{
  "receipt_id": "8F88E46F-625B-4682-BF9A-D68ADD241FFF",
  "system": "CORPIFORM",
  "system_fingerprint": "corpiform-instance-fingerprint",
  "build_hash": "64ce76ebb2cd49e70773fee7177a8398a8bd7658",
  "version": "v0.1.7",
  "command_id": "artifact-0005-cmd-mail-dispatch-001",
  "authority_seal_id": "seal_9c1568bb9ef7423283ca56ecdb7dc278",
  "body": "mail",
  "action": "MAIL_DISPATCH",
  "adapter": "smtp",
  "timestamp": "2026-03-27T16:52:32Z",
  "outcome": "EXECUTED",
  "signature": "KefGInBwNIn07tIoVzpfBoFlob40Sr0EkQcdCT08WOdwfU4I7mAbIvV2lR7TGR9lT361Vdk9c1k/6gVPuKxK16D7PRhIB/cp9kC/E1BIlkUHFMTFH2U/6deHJ52L1KjlXXJQcXya1j+x0ZsLnrJ44PMtjw6M5m6eSlZLWk6tQWoXEji6KAwLPyIg8EdIsk+mpUsNFvp6TStx3z0hxOx6efBE6F5LtMr3rymLi+cI6NtmAnMTXLzrkdJdB1gq753bDF9COJEF9+3Ro562G8GaROEJnmt8egg3oCU2LZn0WpVqGocAMtSd3Kl7wjVsGzdL426PKODY69f5931lixZvGQ=="
}
